{
    "$schema": "http://json-schema.org/draft-07/schema",
    "$id": "http://example.com/example.json",
    "type": "object",
    "title": "The Root Schema",
    "description": "Defines CML JSON to transform data.",
    "properties": {
        "model":{
            "$id": "#/properties/model",
            "type": "object",
            "title": "The Model Schema",
            "description": "A description of model CML JSON will feed to or use of JSON.",
            "default": {},
            "examples": []
        },
        "name": {
            "$id": "#/properties/name",
            "type": "string",
            "title": "The Name Schema",
            "description": "Name for catalyst-ml JSON object.",
            "default": "Name",
            "examples": [
                "FinancialStructure"
            ]
        },
        "description": {
            "$id": "#/properties/description",
            "type": "string",
            "title": "The Description Schema",
            "description": "A place to give a description of overall use/purpose of CML JSON object.",
            "default": "",
            "examples": [
                "Cleaning some financial data"
            ]
        },
        "version": {
            "$id": "#/properties/version",
            "type": "string",
            "title": "The Version Schema",
            "description": "To help track versions of CML Object.",
            "default": "0.0.0",
            "examples": [
                "0.0.1",
                "1.0.1"
            ]
        },
        "createdDate": {
            "$id": "#/properties/createdDate",
            "type": "string",
            "title": "The Createddate Schema",
            "description": "Gives date of when creation or update of CML object.",
            "default": "",
            "examples": [
                "YYYYMMDD",
                "20200101"
            ]
        },
        "input": {
            "$id": "#/properties/input",
            "type": "array",
            "title": "The Input Schema",
            "description": "Describes types properties of input data.",
            "default": [],
            "items": {
                "$id": "#/properties/input/items",
                "type": "object",
                "title": "The Items Schema",
                "description": "Defines a aingle input's meta data.",
                "default": {},
                "examples": [
                    {
                        "label": "inputs",
                        "type": "array"
                    }
                ],
                "required": [
                    "type",
                    "label"
                ],
                "properties": {
                    "type": {
                        "$id": "#/properties/input/items/properties/type",
                        "type": "string",
                        "title": "The Type Schema",
                        "description": "Tells what type the input will be.",
                        "default": "",
                        "examples": [
                            "array",
                            "map"
                        ]
                    },
                    "label": {
                        "$id": "#/properties/input/items/properties/label",
                        "type": "string",
                        "title": "The Label Schema",
                        "description": "Gives a variable name to reference this data in structures or output.",
                        "default": "",
                        "examples": [
                            "inputs",
                            "datain"
                        ]
                    }
                }
            }
        },
        "structure": {
            "$id": "#/properties/structure",
            "type": "array",
            "title": "The Structure Schema",
            "description": "An explanation about the purpose of this instance.",
            "default": [],
            "items": {
                "$id": "#/properties/structure/items",
                "type": "object",
                "title": "The Items Schema",
                "description": "An explanation about the purpose of this instance.",
                "default": {},
                "examples": [
                    {
                        "output": "datatemp",
                        "input": {
                            "data": "$inputs"
                        },
                        "operation": "concatMap"
                    },
                    {
                        "output": "datatemp['Age']",
                        "input": {
                            "data": "$datatemp['Age']",
                            "value": 100.0,
                            "minval": 18.0
                        },
                        "operation": "normalize"
                    }
                ],
                "required": [
                    "operation",
                    "input",
                    "output"
                ],
                "properties": {
                    "operation": {
                        "$id": "#/properties/structure/items/properties/operation",
                        "type": "string",
                        "title": "The Operation Schema",
                        "description": "Gives Name of Operation to run.",
                        "default": "",
                        "examples": [
                            "concatMap"
                        ]
                    },
                    "input": {
                        "$id": "#/properties/structure/items/properties/input",
                        "type": "object",
                        "title": "The Input Schema",
                        "description": "An explanation about the purpose of this instance.",
                        "default": {},
                        "patternProperties": {
                            "^.*$": {
                              "anyOf": [
                                {"type": "string"},
                                {"type": "null"}
                              ]
                            }
                          },
                        "additionalProperties": false,
                        "examples": [
                            {
                                "data": "$inputs"
                            }
                        ]
                    },
                    "params": {
                        "$id": "#/properties/structure/items/properties/params",
                        "type": "object",
                        "title": "The Params Schema",
                        "description": "Defining Parameters for the operation.",
                        "default": {},
                        "patternProperties": {
                            "^.*$": {
                              "anyOf": [
                                {"type": "string"},
                                {"type": "null"}
                              ]
                            }
                          },
                        "additionalProperties": false,
                        "examples": [
                            {
                                "data": "$inputs"
                            }
                        ]
                    },
                    "output": {
                        "$id": "#/properties/structure/items/properties/output",
                        "type": "string",
                        "title": "The Output Schema",
                        "description": "The label given to the data object being output by the operation so it can be used as a variable in other operations.",
                        "default": "",
                        "examples": [
                            "datatemp"
                        ]
                    }
                }
            }
        },
        "output": {
            "$id": "#/properties/output",
            "type": "object",
            "title": "The Output Schema",
            "description": "Defines the output of the cml object.",
            "default": {},
            "examples": [
                {
                    "type": "map",
                    "data": "$datatab"
                }
            ],
            "required": [
                "type",
                "data"
            ],
            "properties": {
                "type": {
                    "$id": "#/properties/output/properties/type",
                    "type": "string",
                    "title": "The Type Schema",
                    "description": "Describes the root type of the output data.",
                    "default": "",
                    "examples": [
                        "map"
                    ]
                },
                "data": {
                    "$id": "#/properties/output/properties/data",
                    "type": "object",
                    "title": "The Data Schema",
                    "description": "Building of output from defined variables.",
                    "default": {},
                    "examples": [
                        "$datatab"
                    ]
                }
            }
        }
    }
}